# name: test/sql/duckvep_ensembl.test
# description: Ensembl core plus tiled FASTA to validated resident DuckVEP model
# group: [duckhts]

require duckhts

statement ok
CREATE SCHEMA duckvep_core;

statement ok
CREATE TABLE duckvep_reference_chunks(chrom VARCHAR, "start" BIGINT, "end" BIGINT, seq VARCHAR);

statement ok
INSERT INTO duckvep_reference_chunks VALUES
  ('1', 0, 20, 'ATGAAACCCCGGGTAACCCC'),
  ('1', 20, 40, 'CCTTTAGGGCATAAAAAAAA');

statement ok
CREATE TABLE duckvep_core.coord_system(
  coord_system_id BIGINT, species_id BIGINT, name VARCHAR, version VARCHAR, rank BIGINT
);

statement ok
INSERT INTO duckvep_core.coord_system VALUES
  (1, 1, 'chromosome', 'GRCh38', 1),
  (2, 2, 'chromosome', 'GRCh38', 1);

statement ok
CREATE TABLE duckvep_core.seq_region(
  seq_region_id BIGINT, name VARCHAR, coord_system_id BIGINT, length BIGINT
);

statement ok
INSERT INTO duckvep_core.seq_region VALUES
  (10, '1', 1, 40),
  (11, '1', 2, 40);

statement ok
CREATE TABLE duckvep_core.seq_region_attrib(
  seq_region_id BIGINT, attrib_type_id BIGINT, value BIGINT
);

statement ok
CREATE TABLE duckvep_core.gene(
  gene_id BIGINT, biotype VARCHAR, is_current BIGINT, stable_id VARCHAR, version BIGINT
);

statement ok
INSERT INTO duckvep_core.gene VALUES
  (20, 'protein_coding', 1, 'ENSG_TEST_1', 1),
  (21, 'protein_coding', 1, 'ENSG_TEST_2', 1);

statement ok
CREATE TABLE duckvep_core.transcript(
  transcript_id BIGINT, gene_id BIGINT, seq_region_id BIGINT,
  seq_region_start BIGINT, seq_region_end BIGINT, seq_region_strand BIGINT,
  biotype VARCHAR, is_current BIGINT, stable_id VARCHAR, version BIGINT
);

statement ok
INSERT INTO duckvep_core.transcript VALUES
  (30, 20, 10, 1, 18, 1, 'protein_coding', 1, 'ENST_TEST_FORWARD', 1),
  (31, 21, 10, 21, 32, -1, 'nonsense_mediated_decay', 1, 'ENST_TEST_REVERSE', 1),
  (32, 21, 10, 21, 32, -1, 'protein_coding', 1, 'ENST_TEST_EDITED', 1);

statement ok
CREATE TABLE duckvep_core.exon(
  exon_id BIGINT, seq_region_id BIGINT, seq_region_start BIGINT,
  seq_region_end BIGINT, seq_region_strand BIGINT, phase BIGINT,
  end_phase BIGINT, is_current BIGINT, stable_id VARCHAR
);

statement ok
INSERT INTO duckvep_core.exon VALUES
  (40, 10, 1, 6, 1, -1, 0, 1, 'ENSE_TEST_1'),
  (41, 10, 11, 18, 1, 0, 0, 1, 'ENSE_TEST_2'),
  (42, 10, 21, 32, -1, 0, 0, 1, 'ENSE_TEST_3');

statement ok
CREATE TABLE duckvep_core.exon_transcript(exon_id BIGINT, transcript_id BIGINT, rank BIGINT);

statement ok
INSERT INTO duckvep_core.exon_transcript VALUES
  (40, 30, 1), (41, 30, 2), (42, 31, 1), (42, 32, 1);

statement ok
CREATE TABLE duckvep_core.translation(
  translation_id BIGINT, transcript_id BIGINT, seq_start BIGINT,
  start_exon_id BIGINT, seq_end BIGINT, end_exon_id BIGINT,
  stable_id VARCHAR, version BIGINT
);

statement ok
INSERT INTO duckvep_core.translation VALUES
  (50, 30, 1, 40, 6, 41, 'ENSP_TEST_FORWARD', 1),
  (51, 31, 1, 42, 9, 42, 'ENSP_TEST_REVERSE', 1),
  (52, 32, 1, 42, 9, 42, 'ENSP_TEST_EDITED', 1);

statement ok
CREATE TABLE duckvep_core.attrib_type(attrib_type_id BIGINT, code VARCHAR);

statement ok
INSERT INTO duckvep_core.attrib_type VALUES
  (60, 'MANE_Select'), (61, 'gencode_basic'), (62, 'ccds_transcript'),
  (63, 'gencode_primary'), (64, 'initial_met'), (65, '_rna_edit'),
  (66, 'codon_table'), (68, 'amino_acid_sub');

statement ok
INSERT INTO duckvep_core.seq_region_attrib VALUES (10, 66, 2);

statement ok
CREATE TABLE duckvep_core.transcript_attrib(
  transcript_id BIGINT, attrib_type_id BIGINT, value VARCHAR
);

statement ok
INSERT INTO duckvep_core.transcript_attrib VALUES
  (30, 60, 'NM_TEST'), (30, 61, '1'), (30, 62, 'CCDS_TEST'), (31, 63, '1'),
  (32, 65, '4 5 A');

statement ok
CREATE TABLE duckvep_core.translation_attrib(
  translation_id BIGINT, attrib_type_id BIGINT, value VARCHAR
);

statement ok
INSERT INTO duckvep_core.translation_attrib VALUES
  (50, 68, '2 2 U'),
  (51, 65, '1 2'),
  (52, 64, '1 1 M');

statement ok
CREATE TABLE duckvep_prepared_regions AS
SELECT * FROM duckvep_ensembl_regions(
  'duckvep_core', 'duckvep_reference_chunks', 'GRCh38'
);

# Ensembl regulation is prepared as its own SoA relation. RegulatoryFeature and
# MotifFeature rows retain distinct feature classes and source IDs; the named
# model loads only the five hot columns while metadata remains relational.
statement ok
CREATE SCHEMA duckvep_funcgen;

statement ok
CREATE TABLE duckvep_funcgen.feature_type(
  feature_type_id BIGINT, name VARCHAR, so_accession VARCHAR, so_term VARCHAR
);

statement ok
INSERT INTO duckvep_funcgen.feature_type VALUES
  (70, 'Promoter', 'SO:0000167', 'promoter'),
  (71, 'EMAR', 'SO:0001720', 'epigenetically_modified_region');

statement ok
CREATE TABLE duckvep_funcgen.regulatory_feature(
  regulatory_feature_id BIGINT, feature_type_id BIGINT, seq_region_id BIGINT,
  seq_region_strand BIGINT, seq_region_start BIGINT, seq_region_end BIGINT,
  stable_id VARCHAR, regulatory_build_id BIGINT
);

statement ok
INSERT INTO duckvep_funcgen.regulatory_feature VALUES
  (80, 70, 10, 0, 2, 6, 'ENSR_TEST_1', 1),
  (81, 71, 10, 0, 20, 22, 'ENSR_TEST_EMAR', 1);

statement ok
CREATE TABLE duckvep_funcgen.motif_feature(
  motif_feature_id BIGINT, binding_matrix_id BIGINT, seq_region_id BIGINT,
  seq_region_start BIGINT, seq_region_end BIGINT, seq_region_strand BIGINT,
  score DOUBLE, stable_id VARCHAR
);

statement ok
INSERT INTO duckvep_funcgen.motif_feature VALUES
  (90, 100, 10, 11, 14, 1, 8.5, 'ENSM_TEST_1');

statement ok
CREATE TABLE duckvep_prepared_regulation AS
SELECT * FROM duckvep_ensembl_regulation_features(
  'duckvep_funcgen', 'duckvep_prepared_regions'
);

query IITTIITTT
SELECT regulation_feature_index, feature_kind, feature_class, source_feature_table,
       source_feature_id, source_feature_type_id,
       source_binding_matrix_id, stable_id, feature_so_term
FROM duckvep_prepared_regulation ORDER BY regulation_feature_index;
----
0	1	regulatory_region	regulatory_feature	80	70	NULL	ENSR_TEST_1	promoter
1	2	transcription_factor_binding_site	motif_feature	90	NULL	100	ENSM_TEST_1	NULL

# VEP 116 deliberately removes epigenetically_modified_region (EMAR) rows
# before it constructs regulatory overlap objects.
query I
SELECT count(*) FROM duckvep_prepared_regulation WHERE stable_id = 'ENSR_TEST_EMAR';
----
0

statement ok
BEGIN TRANSACTION;

statement ok
INSERT INTO duckvep_funcgen.regulatory_feature VALUES
  (82, 999, 10, 0, 20, 22, 'ENSR_TEST_MISSING_TYPE', 1);

statement error
SELECT * FROM duckvep_ensembl_regulation_features(
  'duckvep_funcgen', 'duckvep_prepared_regions'
);
----
regulatory feature type is missing

statement ok
ROLLBACK;

query ITIITI
SELECT seq_region, seq_region_name, sequence_length, source_seq_region_id,
       coord_system_name, coord_system_rank
FROM duckvep_prepared_regions;
----
0	1	40	10	chromosome	1

query I
SELECT source_seq_region_id FROM duckvep_ensembl_regions(
  'duckvep_core', 'duckvep_reference_chunks', 'GRCh38', species_id := 2
);
----
11

statement ok
CREATE TABLE duckvep_prepared_transcripts AS
SELECT * FROM duckvep_ensembl_transcripts(
  'duckvep_core', 'duckvep_reference_chunks', 'GRCh38'
);

query IITTITIITI
SELECT transcript_index, transcript_flags, CAST(cds_sequence AS VARCHAR),
       CAST(post_cds_bases AS VARCHAR),
       octet_length(pre_cds_sequence),
       CAST(post_cds_sequence AS VARCHAR), cds_start, cds_end,
       sequence_withheld_reason, length(exons)
FROM duckvep_prepared_transcripts ORDER BY transcript_index;
----
0	22019	ATGAAAGGGTAA	CC	0	CC	1	16	NULL	2
1	8197	ATGCCCTAA	AGG	0	AGG	24	32	NULL	1
2	259	NULL	NULL	NULL	NULL	24	32	rna_edit	1

query II
SELECT transcript_index, codon_table
FROM duckvep_prepared_transcripts
WHERE cds_sequence IS NOT NULL ORDER BY transcript_index;
----
0	2
1	2

# Official Ensembl dump staging may infer numeric-only attribute columns as
# integers. The importer casts values at its boundary instead of requiring a
# staging-only VARCHAR schema.
statement ok
BEGIN TRANSACTION;

statement ok
CREATE TABLE duckvep_core.transcript_attrib_numeric AS
SELECT transcript_id, attrib_type_id, try_cast(value AS BIGINT) AS value
FROM duckvep_core.transcript_attrib
WHERE try_cast(value AS BIGINT) IS NOT NULL;

statement ok
CREATE TABLE duckvep_core.translation_attrib_numeric AS
SELECT translation_id, attrib_type_id, try_cast(value AS BIGINT) AS value
FROM duckvep_core.translation_attrib
WHERE false;

statement ok
ALTER TABLE duckvep_core.transcript_attrib RENAME TO transcript_attrib_text;

statement ok
ALTER TABLE duckvep_core.transcript_attrib_numeric RENAME TO transcript_attrib;

statement ok
ALTER TABLE duckvep_core.translation_attrib RENAME TO translation_attrib_text;

statement ok
ALTER TABLE duckvep_core.translation_attrib_numeric RENAME TO translation_attrib;

query I
SELECT count(*) FROM duckvep_ensembl_transcripts(
  'duckvep_core', 'duckvep_reference_chunks', 'GRCh38'
);
----
3

statement ok
ROLLBACK;

# Codon tables are sourced from seq_region_attrib, never guessed from a
# chromosome name. Missing attributes use VEP's table-1 default; conflicting
# or BioPerl-unsupported source values reject the import.
statement ok
DELETE FROM duckvep_core.seq_region_attrib WHERE seq_region_id = 10;

query I
SELECT DISTINCT codon_table FROM duckvep_ensembl_transcripts(
  'duckvep_core', 'duckvep_reference_chunks', 'GRCh38'
) WHERE cds_sequence IS NOT NULL;
----
1

statement ok
INSERT INTO duckvep_core.seq_region_attrib VALUES (10, 66, 2), (10, 66, 1);

statement error
SELECT * FROM duckvep_ensembl_transcripts(
  'duckvep_core', 'duckvep_reference_chunks', 'GRCh38'
);
----
sequence-region codon table is invalid or unsupported

statement ok
DELETE FROM duckvep_core.seq_region_attrib WHERE value = 1;

statement ok
UPDATE duckvep_core.seq_region_attrib SET value = 8 WHERE seq_region_id = 10;

statement error
SELECT * FROM duckvep_ensembl_transcripts(
  'duckvep_core', 'duckvep_reference_chunks', 'GRCh38'
);
----
sequence-region codon table is invalid or unsupported

statement ok
UPDATE duckvep_core.seq_region_attrib SET value = 2 WHERE seq_region_id = 10;

query ITT
SELECT transcript_index, edit.alternate_amino_acid, edit.edit_code
FROM duckvep_prepared_transcripts,
LATERAL unnest(peptide_edits) AS u(edit)
ORDER BY transcript_index, edit.protein_position;
----
0	U	amino_acid_sub

statement ok
UPDATE duckvep_core.translation_attrib
SET value = '2 3 UU' WHERE translation_id = 50 AND attrib_type_id = 68;

query IT
SELECT transcript_index, sequence_withheld_reason
FROM duckvep_ensembl_transcripts(
  'duckvep_core', 'duckvep_reference_chunks', 'GRCh38'
) WHERE transcript_index = 0;
----
0	unsupported_translation_edit

statement ok
UPDATE duckvep_core.translation_attrib
SET value = '2 2 U' WHERE translation_id = 50 AND attrib_type_id = 68;

query ITT
SELECT transcript_index, mane_select_refseq, mane_plus_clinical_refseq
FROM duckvep_prepared_transcripts ORDER BY transcript_index;
----
0	NM_TEST	NULL
1	NULL	NULL
2	NULL	NULL

statement ok
INSERT INTO duckvep_core.transcript_attrib VALUES (30, 60, 'NM_CONFLICT');

statement error
SELECT * FROM duckvep_ensembl_transcripts(
  'duckvep_core', 'duckvep_reference_chunks', 'GRCh38'
);
----
a MANE attribute must name exactly one RefSeq transcript

statement ok
DELETE FROM duckvep_core.transcript_attrib WHERE value = 'NM_CONFLICT';

query IIII
SELECT transcript_index, exon.rank, exon.exon_cdna_start, exon.exon_cdna_end
FROM duckvep_prepared_transcripts,
LATERAL unnest(exons) AS u(exon)
ORDER BY transcript_index, exon.rank;
----
0	1	1	6
0	2	7	14
1	1	1	12
2	1	1	12

statement ok
CREATE TABLE duckvep_prepared_receipt AS
SELECT * FROM duckvep_model_receipt(
  'duckvep_prepared_regions', 'duckvep_prepared_transcripts',
  'Ensembl', '116', 'GRCh38',
  repeat('a', 64), repeat('b', 64),
  'all current transcripts on FASTA-covered assembly regions',
  regulation_features_table := 'duckvep_prepared_regulation'
);

query IIIIIII
SELECT region_count, transcript_count, gene_count, coding_transcript_count,
       sequence_backed_transcript_count, sequence_withheld_transcript_count,
       exon_membership_count
FROM duckvep_prepared_receipt;
----
1	3	2	3	2	1	4

query IIIIII
SELECT length(model_sha256), cds_base_count, mature_mirna_transcript_count,
       mature_mirna_segment_count, peptide_edit_count,
       transcript_flank_base_count
FROM duckvep_prepared_receipt;
----
64	21	0	0	1	5

query III
SELECT regulation_feature_count, regulatory_region_count, motif_feature_count
FROM duckvep_prepared_receipt;
----
2	1	1

query TTTT
SELECT source_name, source_version, assembly, transcript_filter
FROM duckvep_prepared_receipt;
----
Ensembl	116	GRCh38	all current transcripts on FASTA-covered assembly regions

query I
SELECT model_sha256 != (
  SELECT model_sha256 FROM duckvep_model_receipt(
    'duckvep_prepared_regions', 'duckvep_prepared_transcripts',
    'Ensembl', '116', 'GRCh38',
    repeat('a', 64), repeat('b', 64),
    'MANE transcripts only',
    regulation_features_table := 'duckvep_prepared_regulation'
  )
) FROM duckvep_prepared_receipt;
----
1

statement error
SELECT * FROM duckvep_model_receipt(
  'duckvep_prepared_regions', 'duckvep_prepared_transcripts',
  'Ensembl', '116', 'GRCh38',
  NULL, repeat('b', 64),
  'all current transcripts on FASTA-covered assembly regions',
  regulation_features_table := 'duckvep_prepared_regulation'
);
----
source and reference SHA-256 values must contain 64 hexadecimal digits

query I
SELECT loaded FROM duckvep_model_load(
  'ensembl-test',
  'SELECT seq_region, sequence_length FROM duckvep_ensembl_regions(''duckvep_core'', ''duckvep_reference_chunks'', ''GRCh38'') ORDER BY seq_region',
  'SELECT transcript_index, seq_region, transcript_start, transcript_end, strand, gene_index, transcript_flags, cds_start, cds_end, cds_sequence, codon_table, pre_cds_sequence, post_cds_sequence FROM duckvep_prepared_transcripts ORDER BY seq_region, transcript_start, transcript_index',
  'SELECT transcript_index, exon.exon_start, exon.exon_end, exon.exon_cdna_start, exon.exon_cdna_end, exon.phase, exon.end_phase FROM duckvep_prepared_transcripts, LATERAL unnest(exons) AS u(exon) ORDER BY transcript_index, exon.exon_cdna_start',
  peptide_edit_query := 'SELECT transcript_index, edit.protein_position, edit.alternate_amino_acid FROM duckvep_prepared_transcripts, LATERAL unnest(peptide_edits) AS u(edit) ORDER BY transcript_index, edit.protein_position',
  transcript_coverage_complete := true
);
----
1

query TTT
SELECT annotation.consequence, annotation.status, coalesce(annotation.reason, '-')
FROM unnest(duckvep_annotate(
  'ensembl-test', 0::UINTEGER, 4::UBIGINT, 'A', 'G', 0::UBIGINT
)) AS u(annotation);
----
missense_variant&splice_region_variant	supported	-

query TT
SELECT annotation.reference_amino_acid, annotation.alternate_amino_acid
FROM unnest(duckvep_annotate(
  'ensembl-test', 0::UINTEGER, 4::UBIGINT, 'A', 'G', 0::UBIGINT
)) AS u(annotation);
----
U	E

query TTT
SELECT annotation.consequence, annotation.status, coalesce(annotation.reason, '-')
FROM unnest(duckvep_annotate(
  'ensembl-test', 0::UINTEGER, 28::UBIGINT, 'G', 'A', 0::UBIGINT
)) AS u(annotation)
ORDER BY annotation.transcript_index;
----
missense_variant&NMD_transcript_variant	supported	-
coding_sequence_variant	unresolved	missing_sequence

query I
SELECT duckvep_model_drop('ensembl-test');
----
1

statement error
SELECT loaded FROM duckvep_model_load(
  'ensembl-bad-peptide-edit',
  'SELECT seq_region, sequence_length FROM duckvep_prepared_regions ORDER BY seq_region',
  'SELECT transcript_index, seq_region, transcript_start, transcript_end, strand, gene_index, transcript_flags, cds_start, cds_end, cds_sequence, codon_table, pre_cds_sequence, post_cds_sequence FROM duckvep_prepared_transcripts ORDER BY seq_region, transcript_start, transcript_index',
  'SELECT transcript_index, exon.exon_start, exon.exon_end, exon.exon_cdna_start, exon.exon_cdna_end, exon.phase, exon.end_phase FROM duckvep_prepared_transcripts, LATERAL unnest(exons) AS u(exon) ORDER BY transcript_index, exon.exon_cdna_start',
  peptide_edit_query := 'SELECT * FROM (VALUES (0::UINTEGER, 2::UINTEGER, ''U''::VARCHAR), (0::UINTEGER, 2::UINTEGER, ''U''::VARCHAR)) edits(transcript_index, protein_position, alternate_amino_acid)'
);
----
peptide-edit query must be ordered and unique

# Ensembl stores mature-miRNA cDNA ranges as repeated transcript attributes.
# The importer projects them through ranked exons into a packed side relation;
# VEP's tier-2 mature term then suppresses the generic noncoding-exon term.
statement ok
INSERT INTO duckvep_core.gene VALUES
  (22, 'miRNA', 1, 'ENSG_TEST_MIRNA', 1);

statement ok
INSERT INTO duckvep_core.transcript VALUES
  (33, 22, 10, 33, 40, 1, 'miRNA', 1, 'ENST_TEST_MIRNA', 1);

statement ok
INSERT INTO duckvep_core.exon VALUES
  (43, 10, 33, 40, 1, -1, -1, 1, 'ENSE_TEST_MIRNA');

statement ok
INSERT INTO duckvep_core.exon_transcript VALUES (43, 33, 1);

statement ok
INSERT INTO duckvep_core.attrib_type VALUES (67, 'miRNA');

statement ok
INSERT INTO duckvep_core.transcript_attrib VALUES (33, 67, '2-5');

statement ok
CREATE TABLE duckvep_prepared_mirna AS
SELECT * FROM duckvep_ensembl_transcripts(
  'duckvep_core', 'duckvep_reference_chunks', 'GRCh38'
);

query III
SELECT mature_mirna_transcript_count, mature_mirna_segment_count,
       regulation_feature_count
FROM duckvep_model_receipt(
  'duckvep_prepared_regions', 'duckvep_prepared_mirna',
  'Ensembl', '116', 'GRCh38', repeat('a', 64), repeat('b', 64),
  'VEP 116 core selection on FASTA-covered assembly regions'
);
----
1	1	0

query IIIII
SELECT transcript_index, region.cdna_start, region.cdna_end,
       region.mature_mirna_start, region.mature_mirna_end
FROM duckvep_prepared_mirna,
LATERAL unnest(mature_mirna_regions) AS u(region)
ORDER BY transcript_index, region.mature_mirna_start;
----
3	2	5	34	37

query I
SELECT loaded FROM duckvep_model_load(
  'ensembl-mirna-test',
  'SELECT seq_region, sequence_length FROM duckvep_prepared_regions ORDER BY seq_region',
  'SELECT transcript_index, seq_region, transcript_start, transcript_end, strand, gene_index, transcript_flags, cds_start, cds_end, cds_sequence, codon_table, pre_cds_sequence, post_cds_sequence FROM duckvep_prepared_mirna ORDER BY seq_region, transcript_start, transcript_index',
  'SELECT transcript_index, exon.exon_start, exon.exon_end, exon.exon_cdna_start, exon.exon_cdna_end, exon.phase, exon.end_phase FROM duckvep_prepared_mirna, LATERAL unnest(exons) AS u(exon) ORDER BY transcript_index, exon.exon_cdna_start',
  mature_mirna_query := 'SELECT transcript_index, region.mature_mirna_start, region.mature_mirna_end FROM duckvep_prepared_mirna, LATERAL unnest(mature_mirna_regions) AS u(region) ORDER BY transcript_index, region.mature_mirna_start',
  transcript_coverage_complete := true
);
----
1

query IT
WITH variants(ord, position) AS (VALUES
  (1, 34::UBIGINT),
  (2, 38::UBIGINT)
)
SELECT ord, annotation.consequence
FROM variants,
LATERAL unnest(duckvep_annotate(
  'ensembl-mirna-test', 0::UINTEGER, position, 'A', 'C', 0::UBIGINT
)) AS u(annotation)
ORDER BY ord;
----
1	mature_miRNA_variant
2	non_coding_transcript_exon_variant

query I
SELECT duckvep_model_drop('ensembl-mirna-test');
----
1

statement ok
DELETE FROM duckvep_core.transcript_attrib WHERE transcript_id = 33;

statement ok
DELETE FROM duckvep_core.attrib_type WHERE attrib_type_id = 67;

statement ok
DELETE FROM duckvep_core.exon_transcript WHERE transcript_id = 33;

statement ok
DELETE FROM duckvep_core.exon WHERE exon_id = 43;

statement ok
DELETE FROM duckvep_core.transcript WHERE transcript_id = 33;

statement ok
DELETE FROM duckvep_core.gene WHERE gene_id = 22;

statement ok
CREATE TABLE duckvep_invalid_reference_chunks AS
SELECT * REPLACE (
  CASE WHEN "start" = 20 THEN 21::BIGINT ELSE "start" END AS "start",
  CASE WHEN "start" = 20 THEN substring(seq, 2) ELSE seq END AS seq
) FROM duckvep_reference_chunks;

statement error
SELECT * FROM duckvep_ensembl_regions(
  'duckvep_core',
  'duckvep_invalid_reference_chunks',
  'GRCh38'
);
----
reference chunks must cover each contig contiguously from zero

# VEP's core transcript source rejects records without a stable ID, artifact
# biotypes, and readthrough_tra transcripts before assigning resident ordinals.
statement ok
UPDATE duckvep_core.transcript SET stable_id = NULL WHERE transcript_id = 31;

query T
SELECT transcript_stable_id FROM duckvep_ensembl_transcripts(
  'duckvep_core', 'duckvep_reference_chunks', 'GRCh38'
) ORDER BY transcript_index;
----
ENST_TEST_FORWARD
ENST_TEST_EDITED

statement ok
UPDATE duckvep_core.transcript
SET stable_id = 'ENST_TEST_REVERSE' WHERE transcript_id = 31;

statement ok
INSERT INTO duckvep_core.attrib_type VALUES (66, 'readthrough_tra');

statement ok
INSERT INTO duckvep_core.transcript_attrib VALUES (31, 66, '1');

statement ok
UPDATE duckvep_core.transcript SET biotype = 'artifact' WHERE transcript_id = 32;

query IT
SELECT transcript_index, transcript_stable_id
FROM duckvep_ensembl_transcripts(
  'duckvep_core', 'duckvep_reference_chunks', 'GRCh38'
) ORDER BY transcript_index;
----
0	ENST_TEST_FORWARD

# Real release-116 fixtures: GRCh38 exercises a real MANE pair and GRCh37
# exercises the archived GENCODE-19 model. Both include MT fail-closed edits.
# Network access is confined to the explicit staging script.
statement ok
CREATE MACRO duckvep_fixture_file(assembly_dir, table_name) AS TABLE
SELECT * FROM read_parquet(
  '__WORKING_DIRECTORY__/test/data/duckvep/ensembl_core/' ||
  assembly_dir || '/' || table_name || '.parquet'
);

statement ok
CREATE SCHEMA duckvep_grch38_core;

statement ok
CREATE VIEW duckvep_grch38_core.attrib_type AS FROM duckvep_fixture_file('grch38', 'attrib_type');

statement ok
CREATE VIEW duckvep_grch38_core.coord_system AS FROM duckvep_fixture_file('grch38', 'coord_system');

statement ok
CREATE VIEW duckvep_grch38_core.exon AS FROM duckvep_fixture_file('grch38', 'exon');

statement ok
CREATE VIEW duckvep_grch38_core.exon_transcript AS FROM duckvep_fixture_file('grch38', 'exon_transcript');

statement ok
CREATE VIEW duckvep_grch38_core.gene AS FROM duckvep_fixture_file('grch38', 'gene');

statement ok
CREATE VIEW duckvep_grch38_core.seq_region AS FROM duckvep_fixture_file('grch38', 'seq_region');

statement ok
CREATE VIEW duckvep_grch38_core.seq_region_attrib AS FROM duckvep_fixture_file('grch38', 'seq_region_attrib');

statement ok
CREATE VIEW duckvep_grch38_core.transcript AS FROM duckvep_fixture_file('grch38', 'transcript');

statement ok
CREATE VIEW duckvep_grch38_core.transcript_attrib AS FROM duckvep_fixture_file('grch38', 'transcript_attrib');

statement ok
CREATE VIEW duckvep_grch38_core.translation AS FROM duckvep_fixture_file('grch38', 'translation');

statement ok
CREATE VIEW duckvep_grch38_core.translation_attrib AS FROM duckvep_fixture_file('grch38', 'translation_attrib');

statement ok
CREATE VIEW duckvep_grch38_reference AS FROM duckvep_fixture_file('grch38', 'reference_chunks');

statement ok
CREATE SCHEMA duckvep_grch38_funcgen;

statement ok
CREATE VIEW duckvep_grch38_funcgen.feature_type AS FROM duckvep_fixture_file('grch38', 'funcgen_feature_type');

statement ok
CREATE VIEW duckvep_grch38_funcgen.regulatory_feature AS FROM duckvep_fixture_file('grch38', 'funcgen_regulatory_feature');

statement ok
CREATE VIEW duckvep_grch38_funcgen.motif_feature AS FROM duckvep_fixture_file('grch38', 'funcgen_motif_feature');

statement ok
CREATE SCHEMA duckvep_grch37_core;

statement ok
CREATE VIEW duckvep_grch37_core.attrib_type AS FROM duckvep_fixture_file('grch37', 'attrib_type');

statement ok
CREATE VIEW duckvep_grch37_core.coord_system AS FROM duckvep_fixture_file('grch37', 'coord_system');

statement ok
CREATE VIEW duckvep_grch37_core.exon AS FROM duckvep_fixture_file('grch37', 'exon');

statement ok
CREATE VIEW duckvep_grch37_core.exon_transcript AS FROM duckvep_fixture_file('grch37', 'exon_transcript');

statement ok
CREATE VIEW duckvep_grch37_core.gene AS FROM duckvep_fixture_file('grch37', 'gene');

statement ok
CREATE VIEW duckvep_grch37_core.seq_region AS FROM duckvep_fixture_file('grch37', 'seq_region');

statement ok
CREATE VIEW duckvep_grch37_core.seq_region_attrib AS FROM duckvep_fixture_file('grch37', 'seq_region_attrib');

statement ok
CREATE VIEW duckvep_grch37_core.transcript AS FROM duckvep_fixture_file('grch37', 'transcript');

statement ok
CREATE VIEW duckvep_grch37_core.transcript_attrib AS FROM duckvep_fixture_file('grch37', 'transcript_attrib');

statement ok
CREATE VIEW duckvep_grch37_core.translation AS FROM duckvep_fixture_file('grch37', 'translation');

statement ok
CREATE VIEW duckvep_grch37_core.translation_attrib AS FROM duckvep_fixture_file('grch37', 'translation_attrib');

statement ok
CREATE VIEW duckvep_grch37_reference AS FROM duckvep_fixture_file('grch37', 'reference_chunks');

statement ok
CREATE TABLE duckvep_grch38_regions AS
SELECT * FROM duckvep_ensembl_regions(
  'duckvep_grch38_core', 'duckvep_grch38_reference', 'GRCh38'
);

statement ok
CREATE TABLE duckvep_grch38_transcripts AS
SELECT * FROM duckvep_ensembl_transcripts(
  'duckvep_grch38_core', 'duckvep_grch38_reference', 'GRCh38'
);

statement ok
CREATE TABLE duckvep_grch38_regulation AS
SELECT * FROM duckvep_ensembl_regulation_features(
  'duckvep_grch38_funcgen', 'duckvep_grch38_regions'
);

statement ok
CREATE TABLE duckvep_grch37_regions AS
SELECT * FROM duckvep_ensembl_regions(
  'duckvep_grch37_core', 'duckvep_grch37_reference', 'GRCh37'
);

statement ok
CREATE TABLE duckvep_grch37_transcripts AS
SELECT * FROM duckvep_ensembl_transcripts(
  'duckvep_grch37_core', 'duckvep_grch37_reference', 'GRCh37'
);

statement ok
CREATE TABLE duckvep_no_regulation(
  regulation_feature_index UINTEGER,
  seq_region UINTEGER,
  feature_start UINTEGER,
  feature_end UINTEGER,
  feature_kind UTINYINT
);

query IIIIIII
SELECT
  (SELECT count(*) FROM duckvep_grch38_regions),
  (SELECT sum(sequence_length) FROM duckvep_grch38_regions),
  count(*),
  count(*) FILTER (WHERE cds_sequence IS NOT NULL),
  count(*) FILTER (WHERE sequence_withheld_reason IS NOT NULL),
  sum(length(exons)),
  count(*) FILTER (WHERE mane_select_refseq IS NOT NULL)
FROM duckvep_grch38_transcripts;
----
3	82401	39	14	0	40	1

query III
SELECT regulation_feature_count, regulatory_region_count, motif_feature_count
FROM duckvep_model_receipt(
  'duckvep_grch38_regions', 'duckvep_grch38_transcripts',
  'Ensembl', '116', 'GRCh38',
  '34eaee64f47916f2a9d3d864377f911424741c7ead12883e47dcf998f9677703',
  '4fb2dcf3cc1844c54e8105695826d099be075c8cd5b18f74ccd80fb0d38d2cdf',
  'all current transcripts and funcgen features on MT, KI270395.1, and HG2047_PATCH',
  regulation_features_table := 'duckvep_grch38_regulation'
);
----
3	0	3

query IIIIIII
SELECT
  (SELECT count(*) FROM duckvep_grch37_regions),
  (SELECT sum(sequence_length) FROM duckvep_grch37_regions),
  count(*),
  count(*) FILTER (WHERE cds_sequence IS NOT NULL),
  count(*) FILTER (WHERE sequence_withheld_reason IS NOT NULL),
  sum(length(exons)),
  count(*) FILTER (WHERE mane_select_refseq IS NOT NULL)
FROM duckvep_grch37_transcripts;
----
2	52717	39	15	0	48	0

query ITT
SELECT transcript_index, transcript_stable_id, mane_select_refseq
FROM duckvep_grch38_transcripts
WHERE mane_select_refseq IS NOT NULL;
----
38	ENST00000715685	NM_032790.4

statement ok
CREATE TABLE duckvep_grch38_receipt AS
SELECT * FROM duckvep_model_receipt(
  'duckvep_grch38_regions', 'duckvep_grch38_transcripts',
  'Ensembl', '116', 'GRCh38',
  '34eaee64f47916f2a9d3d864377f911424741c7ead12883e47dcf998f9677703',
  '4fb2dcf3cc1844c54e8105695826d099be075c8cd5b18f74ccd80fb0d38d2cdf',
  'all current transcripts and funcgen features on MT, KI270395.1, and HG2047_PATCH',
  regulation_features_table := 'duckvep_grch38_regulation'
);

statement ok
CREATE TABLE duckvep_grch37_receipt AS
SELECT * FROM duckvep_model_receipt(
  'duckvep_grch37_regions', 'duckvep_grch37_transcripts',
  'Ensembl', '116', 'GRCh37',
  '768298c5f837c6c386eda3c0d4646b264641cf33dcb577290f480de6b2b91ac4',
  '09de6c8bdf434f9fe29e9803c7403b145452fdeefb5387292af67811f1523d80',
  'all current transcripts on MT and GL000201.1'
);

query TTT
SELECT assembly, model_sha256, transcript_filter
FROM (
  SELECT * FROM duckvep_grch38_receipt
  UNION ALL
  SELECT * FROM duckvep_grch37_receipt
) ORDER BY assembly;
----
GRCh37	0a11b81b8c9ac0c0550e153cc8903650c91b305e826c4d844394c2df2f92b007	all current transcripts on MT and GL000201.1
GRCh38	d5e9d7efe42f561ffe3a7ab9e7871bdd510c603871ac3699874cabc46b82f9db	all current transcripts and funcgen features on MT, KI270395.1, and HG2047_PATCH

query I
SELECT loaded FROM duckvep_model_load(
  'ensembl-grch38-fixture',
  'SELECT seq_region, sequence_length FROM duckvep_grch38_regions ORDER BY seq_region',
  'SELECT transcript_index, seq_region, transcript_start, transcript_end, strand, gene_index, transcript_flags, cds_start, cds_end, cds_sequence, codon_table, pre_cds_sequence, post_cds_sequence FROM duckvep_grch38_transcripts ORDER BY seq_region, transcript_start, transcript_index',
  'SELECT transcript_index, exon.exon_start, exon.exon_end, exon.exon_cdna_start, exon.exon_cdna_end, exon.phase, exon.end_phase FROM duckvep_grch38_transcripts, LATERAL unnest(exons) AS u(exon) ORDER BY transcript_index, exon.exon_cdna_start',
  peptide_edit_query := 'SELECT transcript_index, edit.protein_position, edit.alternate_amino_acid FROM duckvep_grch38_transcripts, LATERAL unnest(peptide_edits) AS u(edit) ORDER BY transcript_index, edit.protein_position',
  interval_feature_query := 'SELECT regulation_feature_index, seq_region, feature_start, feature_end, feature_kind FROM duckvep_grch38_regulation ORDER BY regulation_feature_index',
  transcript_coverage_complete := true
);
----
1

query I
SELECT loaded FROM duckvep_model_load(
  'ensembl-grch37-fixture',
  'SELECT seq_region, sequence_length FROM duckvep_grch37_regions ORDER BY seq_region',
  'SELECT transcript_index, seq_region, transcript_start, transcript_end, strand, gene_index, transcript_flags, cds_start, cds_end, cds_sequence, codon_table, pre_cds_sequence, post_cds_sequence FROM duckvep_grch37_transcripts ORDER BY seq_region, transcript_start, transcript_index',
  'SELECT transcript_index, exon.exon_start, exon.exon_end, exon.exon_cdna_start, exon.exon_cdna_end, exon.phase, exon.end_phase FROM duckvep_grch37_transcripts, LATERAL unnest(exons) AS u(exon) ORDER BY transcript_index, exon.exon_cdna_start',
  peptide_edit_query := 'SELECT transcript_index, edit.protein_position, edit.alternate_amino_acid FROM duckvep_grch37_transcripts, LATERAL unnest(peptide_edits) AS u(edit) ORDER BY transcript_index, edit.protein_position',
  interval_feature_query := 'SELECT regulation_feature_index, seq_region, feature_start, feature_end, feature_kind FROM duckvep_no_regulation ORDER BY regulation_feature_index',
  transcript_coverage_complete := true
);
----
1

query ITTIITT
SELECT annotation.transcript_index, annotation.consequence,
       annotation.status, annotation.cds_position, annotation.protein_position,
       annotation.reference_amino_acid, annotation.alternate_amino_acid
FROM unnest(duckvep_annotate(
  'ensembl-grch38-fixture', 2::UINTEGER, 32522::UBIGINT,
  'C', 'T', 0::UBIGINT
)) AS u(annotation);
----
38	missense_variant	supported	4	2	H	Y

query ITTIITT
SELECT annotation.transcript_index, annotation.consequence,
       annotation.status, annotation.cds_position, annotation.protein_position,
       annotation.reference_amino_acid, annotation.alternate_amino_acid
FROM unnest(duckvep_annotate(
  'ensembl-grch37-fixture', 1::UINTEGER, 9452::UBIGINT,
  'T', 'C', 0::UBIGINT
)) AS u(annotation);
----
37	missense_variant	supported	4	2	Y	H

query ITTT
SELECT annotation.transcript_index, annotation.consequence,
       annotation.status, annotation.reason
FROM unnest(duckvep_annotate(
  'ensembl-grch38-fixture', 0::UINTEGER, 3307::UBIGINT,
  'A', 'C', 0::UBIGINT
)) AS u(annotation);
----
5	start_lost	supported	NULL

query IITT
SELECT annotation.regulation_feature_index, annotation.overlap_object,
       annotation.consequence, annotation.status
FROM unnest(duckvep_annotate(
  'ensembl-grch38-fixture', 1::UINTEGER, 75::UBIGINT,
  'A', 'C', 0::UBIGINT
)) AS u(annotation)
WHERE annotation.overlap_object = 'transcription_factor_binding_site'
ORDER BY annotation.regulation_feature_index;
----
0	transcription_factor_binding_site	TF_binding_site_variant	supported
1	transcription_factor_binding_site	TF_binding_site_variant	supported

query I
SELECT duckvep_model_drop('ensembl-grch38-fixture');
----
1

query I
SELECT duckvep_model_drop('ensembl-grch37-fixture');
----
1
