# name: test/sql/duckvep_ensembl.test
# description: Ensembl core plus tiled FASTA to validated resident DuckVEP model
# group: [duckhts]

require duckhts

statement ok
CREATE SCHEMA duckvep_core;

statement ok
CREATE TABLE duckvep_reference_chunks(chrom VARCHAR, "start" BIGINT, "end" BIGINT, seq VARCHAR);

statement ok
INSERT INTO duckvep_reference_chunks VALUES
  ('1', 0, 20, 'ATGAAACCCCGGGTAACCCC'),
  ('1', 20, 40, 'CCTTTAGGGCATAAAAAAAA');

statement ok
CREATE TABLE duckvep_core.coord_system(
  coord_system_id BIGINT, species_id BIGINT, name VARCHAR, version VARCHAR, rank BIGINT
);

statement ok
INSERT INTO duckvep_core.coord_system VALUES
  (1, 1, 'chromosome', 'GRCh38', 1),
  (2, 2, 'chromosome', 'GRCh38', 1);

statement ok
CREATE TABLE duckvep_core.seq_region(
  seq_region_id BIGINT, name VARCHAR, coord_system_id BIGINT, length BIGINT
);

statement ok
INSERT INTO duckvep_core.seq_region VALUES
  (10, '1', 1, 40),
  (11, '1', 2, 40);

statement ok
CREATE TABLE duckvep_core.gene(
  gene_id BIGINT, biotype VARCHAR, is_current BIGINT, stable_id VARCHAR, version BIGINT
);

statement ok
INSERT INTO duckvep_core.gene VALUES
  (20, 'protein_coding', 1, 'ENSG_TEST_1', 1),
  (21, 'protein_coding', 1, 'ENSG_TEST_2', 1);

statement ok
CREATE TABLE duckvep_core.transcript(
  transcript_id BIGINT, gene_id BIGINT, seq_region_id BIGINT,
  seq_region_start BIGINT, seq_region_end BIGINT, seq_region_strand BIGINT,
  biotype VARCHAR, is_current BIGINT, stable_id VARCHAR, version BIGINT
);

statement ok
INSERT INTO duckvep_core.transcript VALUES
  (30, 20, 10, 1, 18, 1, 'protein_coding', 1, 'ENST_TEST_FORWARD', 1),
  (31, 21, 10, 21, 32, -1, 'nonsense_mediated_decay', 1, 'ENST_TEST_REVERSE', 1),
  (32, 21, 10, 21, 32, -1, 'protein_coding', 1, 'ENST_TEST_EDITED', 1);

statement ok
CREATE TABLE duckvep_core.exon(
  exon_id BIGINT, seq_region_id BIGINT, seq_region_start BIGINT,
  seq_region_end BIGINT, seq_region_strand BIGINT, phase BIGINT,
  end_phase BIGINT, is_current BIGINT, stable_id VARCHAR
);

statement ok
INSERT INTO duckvep_core.exon VALUES
  (40, 10, 1, 6, 1, -1, 0, 1, 'ENSE_TEST_1'),
  (41, 10, 11, 18, 1, 0, 0, 1, 'ENSE_TEST_2'),
  (42, 10, 21, 32, -1, 0, 0, 1, 'ENSE_TEST_3');

statement ok
CREATE TABLE duckvep_core.exon_transcript(exon_id BIGINT, transcript_id BIGINT, rank BIGINT);

statement ok
INSERT INTO duckvep_core.exon_transcript VALUES
  (40, 30, 1), (41, 30, 2), (42, 31, 1), (42, 32, 1);

statement ok
CREATE TABLE duckvep_core.translation(
  translation_id BIGINT, transcript_id BIGINT, seq_start BIGINT,
  start_exon_id BIGINT, seq_end BIGINT, end_exon_id BIGINT,
  stable_id VARCHAR, version BIGINT
);

statement ok
INSERT INTO duckvep_core.translation VALUES
  (50, 30, 1, 40, 6, 41, 'ENSP_TEST_FORWARD', 1),
  (51, 31, 1, 42, 9, 42, 'ENSP_TEST_REVERSE', 1),
  (52, 32, 1, 42, 9, 42, 'ENSP_TEST_EDITED', 1);

statement ok
CREATE TABLE duckvep_core.attrib_type(attrib_type_id BIGINT, code VARCHAR);

statement ok
INSERT INTO duckvep_core.attrib_type VALUES
  (60, 'MANE_Select'), (61, 'gencode_basic'), (62, 'ccds_transcript'),
  (63, 'gencode_primary'), (64, 'initial_met'), (65, '_rna_edit');

statement ok
CREATE TABLE duckvep_core.transcript_attrib(
  transcript_id BIGINT, attrib_type_id BIGINT, value VARCHAR
);

statement ok
INSERT INTO duckvep_core.transcript_attrib VALUES
  (30, 60, 'NM_TEST'), (30, 61, '1'), (30, 62, 'CCDS_TEST'), (31, 63, '1'),
  (32, 65, '4 5 A');

statement ok
CREATE TABLE duckvep_core.translation_attrib(
  translation_id BIGINT, attrib_type_id BIGINT, value VARCHAR
);

statement ok
INSERT INTO duckvep_core.translation_attrib VALUES (52, 64, 'M');

statement ok
CREATE TABLE duckvep_prepared_regions AS
SELECT * FROM duckvep_ensembl_regions(
  'duckvep_core', 'duckvep_reference_chunks', 'GRCh38'
);

query ITIITI
SELECT seq_region, seq_region_name, sequence_length, source_seq_region_id,
       coord_system_name, coord_system_rank
FROM duckvep_prepared_regions;
----
0	1	40	10	chromosome	1

query I
SELECT source_seq_region_id FROM duckvep_ensembl_regions(
  'duckvep_core', 'duckvep_reference_chunks', 'GRCh38', species_id := 2
);
----
11

statement ok
CREATE TABLE duckvep_prepared_transcripts AS
SELECT * FROM duckvep_ensembl_transcripts(
  'duckvep_core', 'duckvep_reference_chunks', 'GRCh38'
);

query IITTITIITI
SELECT transcript_index, transcript_flags, CAST(cds_sequence AS VARCHAR),
       CAST(post_cds_bases AS VARCHAR),
       octet_length(pre_cds_sequence),
       CAST(post_cds_sequence AS VARCHAR), cds_start, cds_end,
       sequence_withheld_reason, length(exons)
FROM duckvep_prepared_transcripts ORDER BY transcript_index;
----
0	21507	ATGAAAGGGTAA	CC	0	CC	1	16	NULL	2
1	8197	ATGCCCTAA	AGG	0	AGG	24	32	NULL	1
2	259	NULL	NULL	NULL	NULL	24	32	rna_edit,initial_methionine	1

query ITT
SELECT transcript_index, mane_select_refseq, mane_plus_clinical_refseq
FROM duckvep_prepared_transcripts ORDER BY transcript_index;
----
0	NM_TEST	NULL
1	NULL	NULL
2	NULL	NULL

statement ok
INSERT INTO duckvep_core.transcript_attrib VALUES (30, 60, 'NM_CONFLICT');

statement error
SELECT * FROM duckvep_ensembl_transcripts(
  'duckvep_core', 'duckvep_reference_chunks', 'GRCh38'
);
----
a MANE attribute must name exactly one RefSeq transcript

statement ok
DELETE FROM duckvep_core.transcript_attrib WHERE value = 'NM_CONFLICT';

query IIII
SELECT transcript_index, exon.rank, exon.exon_cdna_start, exon.exon_cdna_end
FROM duckvep_prepared_transcripts,
LATERAL unnest(exons) AS u(exon)
ORDER BY transcript_index, exon.rank;
----
0	1	1	6
0	2	7	14
1	1	1	12
2	1	1	12

statement ok
CREATE TABLE duckvep_prepared_receipt AS
SELECT * FROM duckvep_model_receipt(
  'duckvep_prepared_regions', 'duckvep_prepared_transcripts',
  'Ensembl', '116', 'GRCh38',
  repeat('a', 64), repeat('b', 64),
  'all current transcripts on FASTA-covered assembly regions'
);

query IIIIIII
SELECT region_count, transcript_count, gene_count, coding_transcript_count,
       sequence_backed_transcript_count, sequence_withheld_transcript_count,
       exon_membership_count
FROM duckvep_prepared_receipt;
----
1	3	2	3	2	1	4

query III
SELECT length(model_sha256), cds_base_count, transcript_flank_base_count
FROM duckvep_prepared_receipt;
----
64	21	5

query TTTT
SELECT source_name, source_version, assembly, transcript_filter
FROM duckvep_prepared_receipt;
----
Ensembl	116	GRCh38	all current transcripts on FASTA-covered assembly regions

query I
SELECT model_sha256 != (
  SELECT model_sha256 FROM duckvep_model_receipt(
    'duckvep_prepared_regions', 'duckvep_prepared_transcripts',
    'Ensembl', '116', 'GRCh38',
    repeat('a', 64), repeat('b', 64),
    'MANE transcripts only'
  )
) FROM duckvep_prepared_receipt;
----
1

statement error
SELECT * FROM duckvep_model_receipt(
  'duckvep_prepared_regions', 'duckvep_prepared_transcripts',
  'Ensembl', '116', 'GRCh38',
  NULL, repeat('b', 64),
  'all current transcripts on FASTA-covered assembly regions'
);
----
source and reference SHA-256 values must contain 64 hexadecimal digits

query I
SELECT loaded FROM duckvep_model_load(
  'ensembl-test',
  'SELECT seq_region, sequence_length FROM duckvep_ensembl_regions(''duckvep_core'', ''duckvep_reference_chunks'', ''GRCh38'') ORDER BY seq_region',
  'SELECT transcript_index, seq_region, transcript_start, transcript_end, strand, gene_index, transcript_flags, cds_start, cds_end, cds_sequence, codon_table, pre_cds_sequence, post_cds_sequence FROM duckvep_prepared_transcripts ORDER BY seq_region, transcript_start, transcript_index',
  'SELECT transcript_index, exon.exon_start, exon.exon_end, exon.exon_cdna_start, exon.exon_cdna_end, exon.phase, exon.end_phase FROM duckvep_prepared_transcripts, LATERAL unnest(exons) AS u(exon) ORDER BY transcript_index, exon.exon_cdna_start',
  transcript_coverage_complete := true
);
----
1

query TTT
SELECT annotation.consequence, annotation.status, coalesce(annotation.reason, '-')
FROM unnest(duckvep_annotate(
  'ensembl-test', 0::UINTEGER, 4::UBIGINT, 'A', 'G', 0::UBIGINT
)) AS u(annotation);
----
missense_variant&splice_region_variant	supported	-

query TTT
SELECT annotation.consequence, annotation.status, coalesce(annotation.reason, '-')
FROM unnest(duckvep_annotate(
  'ensembl-test', 0::UINTEGER, 28::UBIGINT, 'G', 'A', 0::UBIGINT
)) AS u(annotation)
ORDER BY annotation.transcript_index;
----
missense_variant&NMD_transcript_variant	supported	-
coding_sequence_variant	unresolved	missing_sequence

query I
SELECT duckvep_model_drop('ensembl-test');
----
1

statement ok
CREATE TABLE duckvep_invalid_reference_chunks AS
SELECT * REPLACE (
  CASE WHEN "start" = 20 THEN 21::BIGINT ELSE "start" END AS "start",
  CASE WHEN "start" = 20 THEN substring(seq, 2) ELSE seq END AS seq
) FROM duckvep_reference_chunks;

statement error
SELECT * FROM duckvep_ensembl_regions(
  'duckvep_core',
  'duckvep_invalid_reference_chunks',
  'GRCh38'
);
----
reference chunks must cover each contig contiguously from zero

# Real release-116 fixtures: GRCh38 exercises a real MANE pair and GRCh37
# exercises the archived GENCODE-19 model. Both include MT fail-closed edits.
# Network access is confined to the explicit staging script.
statement ok
CREATE MACRO duckvep_fixture_file(assembly_dir, table_name) AS TABLE
SELECT * FROM read_parquet(
  '__WORKING_DIRECTORY__/test/data/duckvep/ensembl_core/' ||
  assembly_dir || '/' || table_name || '.parquet'
);

statement ok
CREATE SCHEMA duckvep_grch38_core;

statement ok
CREATE VIEW duckvep_grch38_core.attrib_type AS FROM duckvep_fixture_file('grch38', 'attrib_type');

statement ok
CREATE VIEW duckvep_grch38_core.coord_system AS FROM duckvep_fixture_file('grch38', 'coord_system');

statement ok
CREATE VIEW duckvep_grch38_core.exon AS FROM duckvep_fixture_file('grch38', 'exon');

statement ok
CREATE VIEW duckvep_grch38_core.exon_transcript AS FROM duckvep_fixture_file('grch38', 'exon_transcript');

statement ok
CREATE VIEW duckvep_grch38_core.gene AS FROM duckvep_fixture_file('grch38', 'gene');

statement ok
CREATE VIEW duckvep_grch38_core.seq_region AS FROM duckvep_fixture_file('grch38', 'seq_region');

statement ok
CREATE VIEW duckvep_grch38_core.transcript AS FROM duckvep_fixture_file('grch38', 'transcript');

statement ok
CREATE VIEW duckvep_grch38_core.transcript_attrib AS FROM duckvep_fixture_file('grch38', 'transcript_attrib');

statement ok
CREATE VIEW duckvep_grch38_core.translation AS FROM duckvep_fixture_file('grch38', 'translation');

statement ok
CREATE VIEW duckvep_grch38_core.translation_attrib AS FROM duckvep_fixture_file('grch38', 'translation_attrib');

statement ok
CREATE VIEW duckvep_grch38_reference AS FROM duckvep_fixture_file('grch38', 'reference_chunks');

statement ok
CREATE SCHEMA duckvep_grch37_core;

statement ok
CREATE VIEW duckvep_grch37_core.attrib_type AS FROM duckvep_fixture_file('grch37', 'attrib_type');

statement ok
CREATE VIEW duckvep_grch37_core.coord_system AS FROM duckvep_fixture_file('grch37', 'coord_system');

statement ok
CREATE VIEW duckvep_grch37_core.exon AS FROM duckvep_fixture_file('grch37', 'exon');

statement ok
CREATE VIEW duckvep_grch37_core.exon_transcript AS FROM duckvep_fixture_file('grch37', 'exon_transcript');

statement ok
CREATE VIEW duckvep_grch37_core.gene AS FROM duckvep_fixture_file('grch37', 'gene');

statement ok
CREATE VIEW duckvep_grch37_core.seq_region AS FROM duckvep_fixture_file('grch37', 'seq_region');

statement ok
CREATE VIEW duckvep_grch37_core.transcript AS FROM duckvep_fixture_file('grch37', 'transcript');

statement ok
CREATE VIEW duckvep_grch37_core.transcript_attrib AS FROM duckvep_fixture_file('grch37', 'transcript_attrib');

statement ok
CREATE VIEW duckvep_grch37_core.translation AS FROM duckvep_fixture_file('grch37', 'translation');

statement ok
CREATE VIEW duckvep_grch37_core.translation_attrib AS FROM duckvep_fixture_file('grch37', 'translation_attrib');

statement ok
CREATE VIEW duckvep_grch37_reference AS FROM duckvep_fixture_file('grch37', 'reference_chunks');

statement ok
CREATE TABLE duckvep_grch38_regions AS
SELECT * FROM duckvep_ensembl_regions(
  'duckvep_grch38_core', 'duckvep_grch38_reference', 'GRCh38'
);

statement ok
CREATE TABLE duckvep_grch38_transcripts AS
SELECT * FROM duckvep_ensembl_transcripts(
  'duckvep_grch38_core', 'duckvep_grch38_reference', 'GRCh38'
);

statement ok
CREATE TABLE duckvep_grch37_regions AS
SELECT * FROM duckvep_ensembl_regions(
  'duckvep_grch37_core', 'duckvep_grch37_reference', 'GRCh37'
);

statement ok
CREATE TABLE duckvep_grch37_transcripts AS
SELECT * FROM duckvep_ensembl_transcripts(
  'duckvep_grch37_core', 'duckvep_grch37_reference', 'GRCh37'
);

query IIIIIII
SELECT
  (SELECT count(*) FROM duckvep_grch38_regions),
  (SELECT sum(sequence_length) FROM duckvep_grch38_regions),
  count(*),
  count(*) FILTER (WHERE cds_sequence IS NOT NULL),
  count(*) FILTER (WHERE sequence_withheld_reason IS NOT NULL),
  sum(length(exons)),
  count(*) FILTER (WHERE mane_select_refseq IS NOT NULL)
FROM duckvep_grch38_transcripts;
----
2	81258	39	1	13	40	1

query IIIIIII
SELECT
  (SELECT count(*) FROM duckvep_grch37_regions),
  (SELECT sum(sequence_length) FROM duckvep_grch37_regions),
  count(*),
  count(*) FILTER (WHERE cds_sequence IS NOT NULL),
  count(*) FILTER (WHERE sequence_withheld_reason IS NOT NULL),
  sum(length(exons)),
  count(*) FILTER (WHERE mane_select_refseq IS NOT NULL)
FROM duckvep_grch37_transcripts;
----
2	52717	39	2	13	48	0

query ITT
SELECT transcript_index, transcript_stable_id, mane_select_refseq
FROM duckvep_grch38_transcripts
WHERE mane_select_refseq IS NOT NULL;
----
38	ENST00000715685	NM_032790.4

statement ok
CREATE TABLE duckvep_grch38_receipt AS
SELECT * FROM duckvep_model_receipt(
  'duckvep_grch38_regions', 'duckvep_grch38_transcripts',
  'Ensembl', '116', 'GRCh38',
  'c5afd2ec87ad7aa402035a070e81068e7bd8f4c5bdae9f3c698f8ff5b2fd63d1',
  '1ccef37f83c0784ebe74d89e4e0db8171e11625cd4b46ff47a9911e0ff471763',
  'all current transcripts on MT and HG2047_PATCH'
);

statement ok
CREATE TABLE duckvep_grch37_receipt AS
SELECT * FROM duckvep_model_receipt(
  'duckvep_grch37_regions', 'duckvep_grch37_transcripts',
  'Ensembl', '116', 'GRCh37',
  '46b8011c01b2628aa2678be753aa854528cf026c8d396afa54e99799d38ff8f0',
  '09de6c8bdf434f9fe29e9803c7403b145452fdeefb5387292af67811f1523d80',
  'all current transcripts on MT and GL000201.1'
);

query TTT
SELECT assembly, model_sha256, transcript_filter
FROM (
  SELECT * FROM duckvep_grch38_receipt
  UNION ALL
  SELECT * FROM duckvep_grch37_receipt
) ORDER BY assembly;
----
GRCh37	5145f11c77aafb961c7428cdbfeeb485545ecef76fcd149c5b88c5671841cfe3	all current transcripts on MT and GL000201.1
GRCh38	75250115e0a344d22c3de89c416a1c60dac18e6f14920579a499991fd5c319b9	all current transcripts on MT and HG2047_PATCH

query I
SELECT loaded FROM duckvep_model_load(
  'ensembl-grch38-fixture',
  'SELECT seq_region, sequence_length FROM duckvep_grch38_regions ORDER BY seq_region',
  'SELECT transcript_index, seq_region, transcript_start, transcript_end, strand, gene_index, transcript_flags, cds_start, cds_end, cds_sequence, codon_table, pre_cds_sequence, post_cds_sequence FROM duckvep_grch38_transcripts ORDER BY seq_region, transcript_start, transcript_index',
  'SELECT transcript_index, exon.exon_start, exon.exon_end, exon.exon_cdna_start, exon.exon_cdna_end, exon.phase, exon.end_phase FROM duckvep_grch38_transcripts, LATERAL unnest(exons) AS u(exon) ORDER BY transcript_index, exon.exon_cdna_start',
  transcript_coverage_complete := true
);
----
1

query I
SELECT loaded FROM duckvep_model_load(
  'ensembl-grch37-fixture',
  'SELECT seq_region, sequence_length FROM duckvep_grch37_regions ORDER BY seq_region',
  'SELECT transcript_index, seq_region, transcript_start, transcript_end, strand, gene_index, transcript_flags, cds_start, cds_end, cds_sequence, codon_table, pre_cds_sequence, post_cds_sequence FROM duckvep_grch37_transcripts ORDER BY seq_region, transcript_start, transcript_index',
  'SELECT transcript_index, exon.exon_start, exon.exon_end, exon.exon_cdna_start, exon.exon_cdna_end, exon.phase, exon.end_phase FROM duckvep_grch37_transcripts, LATERAL unnest(exons) AS u(exon) ORDER BY transcript_index, exon.exon_cdna_start',
  transcript_coverage_complete := true
);
----
1

query ITTIITT
SELECT annotation.transcript_index, annotation.consequence,
       annotation.status, annotation.cds_position, annotation.protein_position,
       annotation.reference_amino_acid, annotation.alternate_amino_acid
FROM unnest(duckvep_annotate(
  'ensembl-grch38-fixture', 1::UINTEGER, 32522::UBIGINT,
  'C', 'T', 0::UBIGINT
)) AS u(annotation);
----
38	missense_variant	supported	4	2	H	Y

query ITTIITT
SELECT annotation.transcript_index, annotation.consequence,
       annotation.status, annotation.cds_position, annotation.protein_position,
       annotation.reference_amino_acid, annotation.alternate_amino_acid
FROM unnest(duckvep_annotate(
  'ensembl-grch37-fixture', 1::UINTEGER, 9452::UBIGINT,
  'T', 'C', 0::UBIGINT
)) AS u(annotation);
----
37	missense_variant	supported	4	2	Y	H

query ITTT
SELECT annotation.transcript_index, annotation.consequence,
       annotation.status, annotation.reason
FROM unnest(duckvep_annotate(
  'ensembl-grch38-fixture', 0::UINTEGER, 3307::UBIGINT,
  'A', 'C', 0::UBIGINT
)) AS u(annotation);
----
5	coding_sequence_variant	unresolved	missing_sequence

query I
SELECT duckvep_model_drop('ensembl-grch38-fixture');
----
1

query I
SELECT duckvep_model_drop('ensembl-grch37-fixture');
----
1
